{
  "batch_schema_version": "gps_shortlist_batch.v1",
  "selector_run_id": "gps_run_2026_03_23_001",
  "generated_at": "2026-03-23T20:15:00Z",
  "normalization_version": "norm.v1.1",
  "shortlist_size": 4,
  "picks": [
    {
      "selector_schema_version": "selector_pick.v1.1",
      "pick_id": "v12_20260323_001",
      "module_id": "v12",
      "module_version": "v12.0.4",
      "event_id": 991100,
      "match_label": "Roma vs Lecce",
      "market_family": "goals",
      "market": "match_under",
      "selection": "Under 3.5 Goals",
      "line": 3.5,
      "odds": 1.62,
      "global_score": 88,
      "confidence_norm": 5,
      "risk_norm": 2,
      "edge_norm": "strong",
      "priority_tier": "Best",
      "conflict_flags": [],
      "correlation_flags": [],
      "executive_rationale": "Pick muito limpa e estável para shortlist.",
      "selector_decision_note": "Top bucket global do dia.",
      "pool_status": "exported_to_bankroll",
      "normalization_version": "norm.v1.1",
      "rank_position": 1,
      "shortlist_bucket": "core"
    },
    {
      "selector_schema_version": "selector_pick.v1.1",
      "pick_id": "corners_20260323_004",
      "module_id": "corners",
      "module_version": "corners.1.0.0",
      "event_id": 878317,
      "match_label": "Osasuna vs Girona",
      "market_family": "corners",
      "market": "match_corners_under",
      "selection": "Under 10.5 Corners",
      "line": 10.5,
      "odds": 1.91,
      "global_score": 84,
      "confidence_norm": 4,
      "risk_norm": 3,
      "edge_norm": "strong",
      "priority_tier": "Top",
      "conflict_flags": [],
      "correlation_flags": [
        "PARTIAL_CLUSTER_OVERLAP"
      ],
      "executive_rationale": "Pick tecnicamente forte, com overlap parcial no cluster do dia.",
      "selector_decision_note": "Pode entrar com corte prudencial.",
      "pool_status": "exported_to_bankroll",
      "normalization_version": "norm.v1.1",
      "rank_position": 2,
      "shortlist_bucket": "satellite"
    },
    {
      "selector_schema_version": "selector_pick.v1.1",
      "pick_id": "btts_20260323_002",
      "module_id": "btts",
      "module_version": "btts.0.9.8",
      "event_id": 991100,
      "match_label": "Roma vs Lecce",
      "market_family": "btts",
      "market": "btts_no",
      "selection": "BTTS No",
      "line": null,
      "odds": 1.7,
      "global_score": 79,
      "confidence_norm": 4,
      "risk_norm": 2,
      "edge_norm": "acceptable",
      "priority_tier": "Actionable",
      "conflict_flags": [
        "FIXTURE_ALREADY_PRESENT"
      ],
      "correlation_flags": [],
      "executive_rationale": "Boa pick mas choca com fixture já ocupada por pick mais forte.",
      "selector_decision_note": "Enviar para gate final da banca.",
      "pool_status": "exported_to_bankroll",
      "normalization_version": "norm.v1.1",
      "rank_position": 3,
      "shortlist_bucket": "optional"
    },
    {
      "selector_schema_version": "selector_pick.v1.1",
      "pick_id": "cards_20260323_006",
      "module_id": "cards",
      "module_version": "cards.1.0.1",
      "event_id": 778899,
      "match_label": "Portimonense vs Braga",
      "market_family": "cards",
      "market": "match_cards_over",
      "selection": "Over 4.5 Cards",
      "line": 4.5,
      "odds": 1.48,
      "global_score": 73,
      "confidence_norm": 3,
      "risk_norm": 3,
      "edge_norm": "acceptable",
      "priority_tier": "Watchlist",
      "conflict_flags": [],
      "correlation_flags": [],
      "executive_rationale": "Pick elegível mas não prioritária em contexto atual.",
      "selector_decision_note": "Pode ficar em reserva.",
      "pool_status": "exported_to_bankroll",
      "normalization_version": "norm.v1.1",
      "rank_position": 4,
      "shortlist_bucket": "optional"
    }
  ]
}